{
  "id": "lesson-19",
  "title": "Aula 19: Introdução aos Sistemas ERP",
  "objective": "Compreender o conceito de ERP, sua evolução histórica e o valor estratégico da integração de processos empresariais.",
  "content": [
    {
      "type": "callout",
      "variant": "info",
      "title": "Preparação pré-aula",
      "content": [
        {
          "type": "paragraph",
          "text": "Revise o mapa de processos do estudo de caso e identifique quais atividades dependem de dados confiáveis para executar sem retrabalho."
        },
        {
          "type": "list",
          "items": [
            {
              "text": "Revise o glossário dos principais módulos (FI, CO, MM, SD, HR)."
            },
            {
              "text": "Traga perguntas sobre licenciamento e modelos de implantação."
            },
            {
              "text": "Liste problemas atuais causados por falta de integração entre áreas."
            }
          ]
        }
      ]
    },
    {
      "type": "lessonPlan",
      "title": "Plano da aula",
      "cards": [
        {
          "icon": "book-open",
          "title": "Visão geral",
          "content": "Entender componentes centrais de um ERP."
        },
        {
          "icon": "tasks",
          "title": "Módulos",
          "content": "Relacionar módulos a processos de negócio."
        },
        {
          "icon": "gears",
          "title": "Integração",
          "content": "Explorar como o ERP conecta áreas e sistemas satélites."
        },
        {
          "icon": "check-circle",
          "title": "Governança",
          "content": "Debater papéis, perfil de acesso e auditoria."
        }
      ]
    },
    {
      "type": "flightPlan",
      "title": "Plano de voo (1h50)",
      "items": [
        "(10 min) Check-in: expectativas e mitos sobre ERP.",
        "(20 min) Aula expositiva: arquitetura, banco de dados e módulos.",
        "(15 min) Análise guiada do fluxo procure-to-pay como exemplo.",
        "(20 min) Dinâmica: mapear entradas e saídas de dois módulos.",
        "(15 min) Discussão sobre perfis de usuários e segregação de funções.",
        "(15 min) Apresentação dos squads com principais aprendizados.",
        "(15 min) Síntese com próximos passos para prototipar."
      ]
    },
    {
      "type": "contentBlock",
      "title": "Conceitos essenciais",
      "content": [
        {
          "type": "paragraph",
          "text": "Sistemas ERP consolidam processos corporativos em uma base única, garantindo visão integrada de finanças, logística, produção, recursos humanos e mais. A padronização dos dados permite rastrear transações ponta a ponta."
        },
        {
          "type": "paragraph",
          "text": "O sucesso depende de configuração adequada, governança de acessos, aderência a processos e integração com soluções especializadas. Entender ciclo de vida (from blueprinting to suporte) é fundamental."
        }
      ]
    },
    {
      "type": "videos",
      "title": "Para aprofundar",
      "videos": [
        {
          "url": "https://example.edu/tgs/videos/erp-fundamentos",
          "title": "Fundamentos de ERP",
          "caption": "Histórico, arquitetura e princípios de modularização."
        },
        {
          "url": "https://example.edu/tgs/videos/case-erp-industria",
          "title": "Case ERP na indústria",
          "caption": "Como uma fábrica reduziu retrabalho com ERP e governança de dados."
        }
      ]
    },
    {
      "type": "contentBlock",
      "title": "Exercício em sala",
      "content": [
        {
          "type": "orderedList",
          "items": [
            {
              "title": "Mapa de módulos",
              "text": "Associe processos do estudo de caso aos módulos ERP correspondentes."
            },
            {
              "title": "Dados críticos",
              "text": "Liste cadastros mestres e justificativas para manutenção centralizada."
            },
            {
              "title": "Papéis",
              "text": "Defina perfis de usuário e segregação de funções para um processo sensível."
            }
          ]
        }
      ]
    },
    {
      "type": "promptTip",
      "title": "Prompt para analisar aderência de módulos",
      "description": "Use para planejar o escopo do ERP no case.",
      "prompt": "Você é consultor de ERP. Recebeu o diagnóstico de processos abaixo. Indique quais módulos devem ser priorizados, dados mestres essenciais e riscos de segregação de funções. Recomende quick wins e iniciativas de médio prazo. Diagnóstico: [cole o resumo do processo].",
      "tips": [
        "Inclua volumetria de transações e maturidade da equipe.",
        "Peça recomendações de indicadores de adoção.",
        "Solicite alertas sobre dependência de planilhas externas."
      ],
      "tags": ["erp", "planejamento"],
      "audience": "teacher"
    },
    {
      "type": "callout",
      "variant": "task",
      "title": "TED pós-aula",
      "content": [
        {
          "type": "paragraph",
          "text": "Produza uma matriz que relacione processos do estudo de caso aos módulos ERP correspondentes, apontando riscos de não cobertura e integrações prioritárias."
        }
      ]
    },
    {
      "type": "checklist",
      "title": "Ao final, valide se você",
      "items": [
        "Descreveu claramente os módulos relevantes e seus responsáveis.",
        "Mapeou dados mestres e relacionou a fontes confiáveis.",
        "Registrou riscos operacionais associados ao uso inadequado do ERP."
      ]
    }
  ],
  "formatVersion": "md3.lesson.v1",
  "slug": "aula-19-introducao-aos-sistemas-erp",
  "summary": "Apresenta fundamentos dos sistemas ERP, sua evolução histórica e o papel estratégico da integração de processos empresariais.",
  "objectives": [
    "Definir ERP e reconhecer seus componentes estruturantes.",
    "Relacionar evolução tecnológica com expansão de escopo dos ERPs.",
    "Avaliar criticamente benefícios e desafios associados à adoção da solução."
  ],
  "competencies": [
    "Pensamento sistêmico aplicado a processos corporativos",
    "Avaliação crítica de tecnologias empresariais",
    "Comunicação escrita"
  ],
  "outcomes": [
    "Entrega resumo crítico refletindo impactos do ERP.",
    "Identifica fatores sociotécnicos relevantes em discussões orais.",
    "Relaciona exemplos práticos com conceitos apresentados."
  ],
  "prerequisites": [
    "Revisar mapa de sistemas empresariais elaborado na aula 15.",
    "Trazer exemplos de sistemas utilizados em experiências profissionais ou familiares."
  ],
  "tags": ["aula-19-erp"],
  "duration": 110,
  "modality": "in-person",
  "resources": [
    {
      "label": "Linha do tempo da evolução dos ERPs",
      "url": "https://example.edu/tgs/guias/linha-tempo-erp",
      "type": "guide"
    },
    {
      "label": "Glossário ERP básico",
      "url": "https://example.edu/tgs/guias/glossario-erp",
      "type": "handout"
    }
  ],
  "bibliography": [
    "MONK, Ellen; WAGNER, Bret. Concepts in Enterprise Resource Planning. Cengage, 2021.",
    "DAVENPORT, Thomas. Mission Critical: Realizing the Promise of Enterprise Systems. Harvard Business Review Press, 2000."
  ],
  "assessment": {
    "type": "formative",
    "description": "Resumo crítico publicado no AVA."
  },
  "metadata": {
    "status": "draft",
    "updatedAt": "2025-02-15T00:00:00.000Z",
    "owners": ["Profa. Marina Duarte"],
    "sources": ["Plano de ensino TGS 2025.1", "Notas de planejamento ERP"]
  }
}
